title,category,audience,question,answer,keywords
Enrollment 2026,Admission,"Student, Applicant","When is enrollment for 2026?","The enrollment period for School Year 2026 starts on February 26, 2026.","enrollment, registration, 2026, admission, schedule"
Entrance Exam 2026,Admission,"Applicant, Student","When is the entrance exam for 2026?","The entrance examination for incoming students will be held from January 15–30, 2026. Details will be posted on the SSU official website.","exam, entrance, admission, 2026, schedule"
Admission Requirements,Admission,"Applicant","What are the admission requirements?","Applicants must submit Form 138, birth certificate, certificate of good moral character, and 2x2 ID photo.","requirements, admission, documents, application"
Courses Offered,Admission,"Applicant, Student","What courses are offered at SorSU?","Sorsogon State University offers programs in IT, Education, Engineering, Business, Agriculture, and more. Course availability may vary by campus.","courses, programs, degrees, admission"
Transfer Students,Admission,"Transferee","Can I transfer to Sorsogon State University?","Yes. Transferees must submit a transfer credential, transcript of records, and meet program-specific requirements.","transfer, admission, requirements, student"
Shiftee Policy,Admission,"Student","Can I shift to another program?","Yes. Students may shift by submitting a written request and securing approval from both program chairs.","shift, course change, policy, admission"
Foreign Students,Admission,"Foreign Applicant","Does SorSU accept foreign students?","Yes. Foreign applicants must comply with CHED and DFA requirements and provide authenticated academic records.","foreign, international, admission, requirements"
