title,category,audience,question,answer,keywords
Tuition Fees,Financial,"Student, Parent","How much is the tuition fee at SorSU?","SorSU is a state university and offers free tuition for qualified students under the Universal Access to Quality Tertiary Education Act.","tuition, fees, free education, cost"
Scholarships,Financial,"Student","Are there scholarships available?","Yes. SorSU offers academic, athletic, and government-funded scholarships such as CHED and DOST.","scholarship, financial aid, grant"
Payment Methods,Financial,"Student, Parent","How can I pay my school fees?","Payments may be made at the university cashier or through accredited bank partners. Always request an official receipt.","payment, cashier, bank, fees"
Outstanding Balance,Financial,"Student","How can I check my outstanding balance?","You can check your account status at the Cashier’s Office or through the student portal if enabled.","balance, fees, student account"
Refund Policy,Financial,"Student, Parent","Can I request a refund if I withdraw from the semester?","Refunds are allowed only within the first two weeks of classes and subject to administrative approval.","refund, withdrawal, financial, fees"
Allowance,Financial,"Student","Does SorSU provide student allowances?","Only qualified scholars and grantees under government programs may receive allowances.","allowance, stipend, scholarship, grant"
